{
  "schema_version": "1.0",
  "handoff_id": "handoff_0002",
  "direction": "assessment_to_tutor",
  "task": "reteach_weak_concepts",
  "context": {
    "learner_session_id": "session_0001",
    "round": "first"
  },
  "sources": [
    {
      "lesson_id": "lesson_cell_membranes",
      "lesson_version": 2,
      "url": "https://cellandmolecularbiology.pressbooks.tru.ca/chapter/2-1/",
      "license": "CC BY-NC-SA 4.0",
      "attribution": "Cell & Molecular Biology, Marg Sonnenfeld and Jonathan (Jung Lynn) Jung, Thompson Rivers University"
    }
  ],
  "expected_output": "A revised short explanation covering only the weak concepts listed, grounded in the same lesson.",
  "uncertainty": {
    "level": "none",
    "reasons": []
  },
  "payload": {
    "lesson_id": "lesson_cell_membranes",
    "lesson_version": 2,
    "quiz_id": "quiz_0001",
    "attempt_id": "attempt_0001",
    "score": 6,
    "weak_concepts": [
      {
        "concept_id": "c_fatty_acid_saturation",
        "missed_count": 2,
        "note": "Confused which type of tail causes kinks."
      },
      {
        "concept_id": "c_cholesterol_buffer",
        "missed_count": 2
      }
    ]
  }
}
